<?xml version='1.0' encoding='utf-8'?>
<dataset xmlns:xsi="http://www.w3.org/2001/XMLSchema-instance" xsi:noNamespaceSchemaLocation="../xsd/dataset.xsd">
    <purchase_order id="1" user_account_id="1" order_address_id="1" serial_number="asdf" total_price="100.00"
                    delivery_fee="10.00" discount_amount="20.00" order_amount="80.00" status="-1" paid_times="1"
                    paid_status="1" flag="1" cancel_reason="fdsaf" comment="fdajslfj"
                    created_at="2015-10-22 13:24:18"
                    updated_at="2015-10-22 13:24:18" delete_state="1"/>
    <purchase_order id="2" user_account_id="1" order_address_id="1" serial_number="889546856"  total_price="100.00"
                    delivery_fee="10.00" discount_amount="20.00" order_amount="80.00" status="4" paid_times="1"
                    paid_status="1" flag="1" cancel_reason="fdsaf" comment="fdajslfj" created_at="2015-10-22 13:24:18"
                    updated_at="2015-10-22 13:24:18"/>
    <purchase_order id="3" user_account_id="1" order_address_id="1" serial_number="432894328d" total_price="100.00"
                    delivery_fee="10.00" discount_amount="20.00" order_amount="80.00" status="1" paid_times="1"
                    paid_status="1" flag="1" cancel_reason="fdsaf" comment="fdajslfj" created_at="2015-10-22 13:24:18"
                    updated_at="2015-10-22 13:24:18"/>
    <purchase_order id="4" user_account_id="1" order_address_id="1" serial_number="4328943282q" total_price="100.00"
                    delivery_fee="10.00" discount_amount="20.00" order_amount="80.00" status="1" paid_times="1"
                    paid_status="1" flag="1" cancel_reason="fdsaf" comment="fdajslfj" created_at="2015-10-22 13:24:18"
                    updated_at="2015-10-22 13:24:18"/>
    <purchase_order id="5" user_account_id="1" order_address_id="1" serial_number="432894328w" total_price="100.00"
                    delivery_fee="10.00" discount_amount="20.00" order_amount="80.00" status="1" paid_times="1"
                    paid_status="1" flag="1" cancel_reason="fdsaf" comment="fdajslfj" created_at="2015-10-22 13:24:18"
                    updated_at="2015-10-22 13:24:18"/>
    <purchase_order id="6" user_account_id="1" order_address_id="1" serial_number="12345" total_price="100.00"
                    delivery_fee="10.00" discount_amount="20.00" order_amount="80.00" status="1" paid_times="1"
                    paid_status="1" flag="1" cancel_reason="fdsaf" comment="fdajslfj" created_at="2015-10-22 13:24:18"
                    updated_at="2015-10-22 13:24:18"/>
    <purchase_order id="7" user_account_id="1" order_address_id="1" serial_number="123456" total_price="100.00"
                    delivery_fee="10.00" discount_amount="20.00" order_amount="80.00" status="1" paid_times="1"
                    paid_status="1" flag="1" cancel_reason="fdsaf" comment="fdajslfj" created_at="2015-10-22 13:24:18"
                    paid_at="2017-06-30 13:24:18"
                    updated_at="2015-10-22 13:24:18"/>
    <purchase_order id="8" user_account_id="1" order_address_id="1" serial_number="Y1234567890" total_price="100.00"
                    delivery_fee="10.00" discount_amount="20.00" order_amount="80.00" status="1" paid_times="1"
                    paid_status="1" flag="1" cancel_reason="fdsaf" comment="fdajslfj" created_at="2015-10-22 13:24:18"
                    paid_at="2017-06-30 13:24:18"
                    comment_status="0"
                    updated_at="2015-10-22 13:24:18"/>
    <purchase_order id="9" user_account_id="1" order_address_id="1" serial_number="Y1234567891" total_price="100.00"
                    delivery_fee="10.00" discount_amount="20.00" order_amount="80.00" status="1" paid_times="1"
                    paid_status="1" flag="1" cancel_reason="fdsaf" comment="fdajslfj" created_at="2015-10-22 13:24:18"
                    comment_status="0"
                    paid_at="2017-06-30 13:24:18"
                    updated_at="2015-10-22 13:24:18"/>
</dataset>
