<?xml version='1.0' encoding='utf-8'?>
<dataset xmlns:xsi="http://www.w3.org/2001/XMLSchema-instance" xsi:noNamespaceSchemaLocation="../xsd/dataset.xsd">
    <order_item id="1"
                purchase_order_id="1"
                seller_account_id="3"
                item_id="100"
                item_sku_id="50"
                item_snapshot_id="80"
                number="30"
                unit_price="100.00"
                item_name="冬高端定制双面羊绒毛尼中国风改良旗袍大衣独立设计师品牌女装"
                item_sku_name="S 红色"
                item_image_key="FDSFAFDGGGG"
                delivery_status="1"
                comment_state="0"
                purchase_order_serial_number="abc"/>
    <order_item id="2"
                purchase_order_id="2"
                delivery_status="2"
                seller_account_id="3"
                item_id="100"
                item_sku_id="50"
                item_snapshot_id="80"
                number="30"
                unit_price="100.00"
                item_name="冬高端定制双面羊绒毛尼中国风改良旗袍大衣独立设计师品牌女装"
                item_sku_name="S 红色"
                item_image_key="FDSFAFDGGGG"
                purchase_order_serial_number="abc1"/>
    <order_item id="3"
                purchase_order_id="3"
                delivery_status="3"
                seller_account_id="3"
                item_id="100"
                item_sku_id="50"
                item_snapshot_id="80"
                number="30"
                unit_price="100.00"
                item_name="冬高端定制双面羊绒毛尼中国风改良旗袍大衣独立设计师品牌女装"
                item_sku_name="S 红色"
                item_image_key="FDSFAFDGGGG"
                purchase_order_serial_number="abc2"/>
    <order_item id="4"
                purchase_order_id="4"
                delivery_status="4"
                seller_account_id="3"
                item_id="100"
                item_sku_id="50"
                item_snapshot_id="80"
                number="30"
                unit_price="100.00"
                item_name="冬高端定制双面羊绒毛尼中国风改良旗袍大衣独立设计师品牌女装"
                item_sku_name="S 红色"
                item_image_key="FDSFAFDGGGG"
                purchase_order_serial_number="abc3"/>
    <order_item id="5"
                purchase_order_id="8"
                delivery_status="4"
                seller_account_id="3"
                item_id="100"
                item_sku_id="50"
                item_snapshot_id="80"
                number="30"
                unit_price="100.00"
                item_name="冬高端定制双面羊绒毛尼中国风改良旗袍大衣独立设计师品牌女装"
                item_sku_name="S 红色"
                item_image_key="FDSFAFDGGGG"
                purchase_order_serial_number="Y1234567890"/>

    <order_item id="6"
                purchase_order_id="9"
                delivery_status="4"
                seller_account_id="3"
                item_id="100"
                item_sku_id="50"
                item_snapshot_id="80"
                number="30"
                unit_price="100.00"
                item_name="冬高端定制双面羊绒毛尼中国风改良旗袍大衣独立设计师品牌女装"
                item_sku_name="S 红色"
                item_image_key="FDSFAFDGGGG"
                comment_state="0"
                purchase_order_serial_number="Y1234567891"/>

    <order_item id="7"
                purchase_order_id="9"
                delivery_status="4"
                seller_account_id="3"
                item_id="100"
                item_sku_id="50"
                item_snapshot_id="80"
                number="30"
                unit_price="100.00"
                item_name="冬高端定制双面羊绒毛尼中国风改良旗袍大衣独立设计师品牌女装"
                item_sku_name="S 红色"
                item_image_key="FDSFAFDGGGG"
                comment_state="0"
                purchase_order_serial_number="Y1234567891"/>
    <order_item id="8"
                purchase_order_id="9"
                delivery_status="4"
                seller_account_id="3"
                item_id="100"
                item_sku_id="50"
                item_snapshot_id="80"
                number="30"
                unit_price="100.00"
                item_name="冬高端定制双面羊绒毛尼中国风改良旗袍大衣独立设计师品牌女装"
                item_sku_name="S 红色"
                item_image_key="FDSFAFDGGGG"
                comment_state="1"
                confirm_at="2017-06-30 13:24:18"
                purchase_order_serial_number="Y1234567891"/>
</dataset>
